{
  "case_recipe_schema_version": "0.1.0",
  "recipe_id": "sc_mono1_u16_tiny_1x1_rle_lossless",
  "recipe_version": "0.1.0",
  "binding": {
    "case_id": "classic/sc/mono1_u16_tiny_1x1_rle_lossless"
  },
  "kind": "dicom",
  "plan_provider_id": "native.sc_plan",
  "dependencies": [],
  "provider_parameters": {},
  "validation_rule_ids": [
    "validation.sc.encapsulation",
    "validation.sc.pixel"
  ],
  "projection_rule_ids": [
    "projection.curated"
  ],
  "dicom": {
    "artifacts": [
      {
        "logical_id": "instance",
        "order": 0,
        "template": {
          "template_id": "classic/secondary-capture/monochrome",
          "template_version": "1.0.0"
        },
        "output": {
          "role": "instance",
          "path": "classic/sc/mono1_u16_tiny_1x1_rle_lossless/instance.dcm"
        },
        "encoding": {
          "transfer_syntax_uid": "1.2.840.10008.1.2.5",
          "sequence_length_policy": "default",
          "item_length_policy": "default",
          "offset_table_policy": "populated_basic",
          "fragmentation_policy": "one_per_frame",
          "preamble_policy": "zero_filled",
          "file_meta_policy": "standard",
          "non_template_encoding_provider_id": "encoding.native.rle_lossless"
        },
        "parameters": {},
        "secondary_capture": {
          "rows": 1,
          "columns": 1,
          "frames": 1,
          "samples_per_pixel": 1,
          "photometric_interpretation": "MONOCHROME1",
          "bits_allocated": 16,
          "bits_stored": 16,
          "high_bit": 15,
          "pixel_representation": 0,
          "pixel_data_vr": "OB",
          "stored_value_type": "u16",
          "stored_values": [
            65535
          ],
          "frame_sha256": [
            "ca2fd00fa001190744c15c317643ab092e7048ce086a243e2be9437c898de1bb"
          ],
          "visual_pattern": "1x1_inverse_monochrome_u16_rle_lossless_tiny_maximum",
          "semantic_note": "very small unsigned MONOCHROME1 Pixel Data decodes from one RLE Lossless fragment with inverse grayscale polarity",
          "pixel_min": 65535,
          "pixel_max": 65535
        },
        "attribute_operations": [],
        "content": {
          "provider_id": "content.sc.pixel_pattern",
          "parameters": {}
        },
        "validation_rule_ids": [
          "validation.sc.pixel",
          "validation.sc.encapsulation"
        ],
        "projection_rule_ids": [
          "projection.curated"
        ],
        "determinism": "byte_stable",
        "stressors": [
          "minimal_secondary_capture",
          "encapsulated_pixel_data",
          "rle_lossless_transfer_syntax"
        ]
      }
    ]
  }
}
