{"case_recipe_schema_version":"0.1.0","recipe_id":"minimal","recipe_version":"1.0.0","binding":{"case_id":"classic/sc/minimal"},"kind":"qualification","plan_provider_id":"qualification.bounded_plan","dependencies":[],"provider_parameters":{"qualification_provider_id":"bounded_resource_qualification","payload_policy":"evidence_only"},"validation_rule_ids":["validation.qualification"],"projection_rule_ids":["projection.qualification"],"qualification":{"parameters":{"qualification_kind":"bounded_resource_qualification"},"resource_policy":{"max_input_bytes":0,"max_output_bytes":0,"max_operations":1},"retention":"evidence_only"}}
