{
  "case_recipe_schema_version": "0.1.0",
  "recipe_id": "sc_mono2_u16",
  "recipe_version": "0.1.0",
  "binding": {
    "case_id": "classic/sc/mono2_u16_explicit_le"
  },
  "kind": "dicom",
  "plan_provider_id": "native.sc_plan",
  "dependencies": [],
  "provider_parameters": {},
  "validation_rule_ids": [
    "validation.sc.pixel"
  ],
  "projection_rule_ids": [
    "projection.curated"
  ],
  "dicom": {
    "artifacts": [
      {
        "logical_id": "instance",
        "order": 0,
        "template": {
          "template_id": "classic/secondary-capture/monochrome",
          "template_version": "1.0.0"
        },
        "output": {
          "role": "instance",
          "path": "classic/sc/mono2_u16_explicit_le/instance.dcm"
        },
        "encoding": {
          "transfer_syntax_uid": "1.2.840.10008.1.2.1",
          "sequence_length_policy": "default",
          "item_length_policy": "default",
          "offset_table_policy": "none",
          "fragmentation_policy": "native",
          "preamble_policy": "zero_filled",
          "file_meta_policy": "standard"
        },
        "parameters": {},
        "secondary_capture": {
          "rows": 2,
          "columns": 2,
          "frames": 1,
          "samples_per_pixel": 1,
          "photometric_interpretation": "MONOCHROME2",
          "bits_allocated": 16,
          "bits_stored": 16,
          "high_bit": 15,
          "pixel_representation": 0,
          "pixel_data_vr": "OW",
          "stored_value_type": "u16",
          "stored_values": [
            0,
            21845,
            43690,
            65535
          ],
          "frame_sha256": [
            "d08bba5811a12539ff2f0d8c7ec743f442798f3340e8f865835601fb81944688"
          ],
          "visual_pattern": "2x2_monochrome_u16_gradient",
          "semantic_note": "16-bit unsigned MONOCHROME2 samples span the full stored range",
          "pixel_min": 0,
          "pixel_max": 65535
        },
        "attribute_operations": [],
        "content": {
          "provider_id": "content.sc.pixel_pattern",
          "parameters": {}
        },
        "validation_rule_ids": [
          "validation.sc.pixel"
        ],
        "projection_rule_ids": [
          "projection.curated"
        ],
        "determinism": "byte_stable",
        "stressors": [
          "minimal_secondary_capture",
          "native_ob_pixel_data"
        ]
      }
    ]
  }
}
