{
  "case_recipe_schema_version": "0.1.0",
  "recipe_id": "qualification_eot_u64_overflow",
  "recipe_version": "0.1.0",
  "binding": {
    "case_id": "qualification/encapsulation/eot_u64_overflow"
  },
  "kind": "qualification",
  "plan_provider_id": "qualification.eot_arithmetic_plan",
  "dependencies": [],
  "provider_parameters": {
    "qualification_provider_id": "encapsulation.checked_eot_arithmetic",
    "payload_policy": "evidence_only"
  },
  "validation_rule_ids": [
    "validation.qualification"
  ],
  "projection_rule_ids": [
    "projection.qualification"
  ],
  "qualification": {
    "parameters": {
      "qualification_kind": "checked_eot_u64_overflow",
      "fragment_lengths": [
        18446744073709551615
      ],
      "arithmetic_steps": [
        "pad_fragment_to_even",
        "add_item_header",
        "accumulate_frame_offset"
      ],
      "expected_error": "fragment_padding_overflow"
    },
    "resource_policy": {
      "max_input_bytes": 0,
      "max_output_bytes": 0,
      "max_operations": 3
    },
    "retention": "evidence_only"
  }
}
