{
  "case_recipe_schema_version": "0.1.0",
  "recipe_id": "sc_mono2_u8_explicit_be",
  "recipe_version": "0.1.0",
  "binding": {
    "case_id": "classic/sc/mono2_u8_explicit_be"
  },
  "kind": "dicom",
  "plan_provider_id": "native.sc_plan",
  "dependencies": [],
  "provider_parameters": {},
  "validation_rule_ids": [
    "validation.sc.pixel"
  ],
  "projection_rule_ids": [
    "projection.curated"
  ],
  "dicom": {
    "artifacts": [
      {
        "logical_id": "instance",
        "order": 0,
        "template": {
          "template_id": "classic/secondary-capture/monochrome",
          "template_version": "1.0.0"
        },
        "output": {
          "role": "instance",
          "path": "classic/sc/mono2_u8_explicit_be/instance.dcm"
        },
        "encoding": {
          "transfer_syntax_uid": "1.2.840.10008.1.2.2",
          "sequence_length_policy": "default",
          "item_length_policy": "default",
          "offset_table_policy": "none",
          "fragmentation_policy": "native",
          "preamble_policy": "zero_filled",
          "file_meta_policy": "standard",
          "non_template_encoding_provider_id": "encoding.native.explicit_vr_big_endian"
        },
        "parameters": {},
        "secondary_capture": {
          "rows": 2,
          "columns": 2,
          "frames": 1,
          "samples_per_pixel": 1,
          "photometric_interpretation": "MONOCHROME2",
          "bits_allocated": 8,
          "bits_stored": 8,
          "high_bit": 7,
          "pixel_representation": 0,
          "pixel_data_vr": "OB",
          "stored_value_type": "u8",
          "stored_values": [
            0,
            85,
            170,
            255
          ],
          "frame_sha256": [
            "03b722a15d4658be01f1eb9def5e8be124710cc0e88842f78107abfda3e23ea8"
          ],
          "visual_pattern": "2x2_monochrome_gradient",
          "semantic_note": "minimum sample value displays as black with retired Explicit VR Big Endian dataset encoding",
          "pixel_min": 0,
          "pixel_max": 255
        },
        "attribute_operations": [],
        "content": {
          "provider_id": "content.sc.pixel_pattern",
          "parameters": {}
        },
        "validation_rule_ids": [
          "validation.sc.pixel"
        ],
        "projection_rule_ids": [
          "projection.curated"
        ],
        "determinism": "byte_stable",
        "stressors": [
          "minimal_secondary_capture",
          "native_ob_pixel_data",
          "retired_transfer_syntax",
          "explicit_vr_big_endian_dataset"
        ]
      }
    ]
  }
}
