{
  "case_recipe_schema_version": "0.1.0",
  "recipe_id": "sc_mono1_u16_multiframe_rle_lossless",
  "recipe_version": "0.1.0",
  "binding": {
    "case_id": "classic/sc/mono1_u16_multiframe_rle_lossless"
  },
  "kind": "dicom",
  "plan_provider_id": "native.sc_plan",
  "dependencies": [],
  "provider_parameters": {},
  "validation_rule_ids": [
    "validation.sc.encapsulation",
    "validation.sc.pixel"
  ],
  "projection_rule_ids": [
    "projection.curated"
  ],
  "dicom": {
    "artifacts": [
      {
        "logical_id": "instance",
        "order": 0,
        "template": {
          "template_id": "classic/secondary-capture/monochrome",
          "template_version": "1.0.0"
        },
        "output": {
          "role": "instance",
          "path": "classic/sc/mono1_u16_multiframe_rle_lossless/instance.dcm"
        },
        "encoding": {
          "transfer_syntax_uid": "1.2.840.10008.1.2.5",
          "sequence_length_policy": "default",
          "item_length_policy": "default",
          "offset_table_policy": "populated_basic",
          "fragmentation_policy": "one_per_frame",
          "preamble_policy": "zero_filled",
          "file_meta_policy": "standard",
          "non_template_encoding_provider_id": "encoding.native.rle_lossless"
        },
        "parameters": {},
        "secondary_capture": {
          "rows": 2,
          "columns": 2,
          "frames": 2,
          "samples_per_pixel": 1,
          "photometric_interpretation": "MONOCHROME1",
          "bits_allocated": 16,
          "bits_stored": 16,
          "high_bit": 15,
          "pixel_representation": 0,
          "pixel_data_vr": "OB",
          "stored_value_type": "u16",
          "stored_values": [
            0,
            21845,
            43690,
            65535,
            65535,
            43690,
            21845,
            0
          ],
          "frame_sha256": [
            "d08bba5811a12539ff2f0d8c7ec743f442798f3340e8f865835601fb81944688",
            "192b9581485d73b3cb5429c591c9435f96af03cea7b79b2a8b783ddbb1c2070f"
          ],
          "visual_pattern": "2x2x2_inverse_monochrome_u16_rle_lossless_gradient_reversed",
          "semantic_note": "two unsigned 16-bit MONOCHROME1 frames decode from separate RLE Lossless fragments with inverse grayscale polarity",
          "pixel_min": 0,
          "pixel_max": 65535
        },
        "attribute_operations": [],
        "content": {
          "provider_id": "content.sc.pixel_pattern",
          "parameters": {}
        },
        "validation_rule_ids": [
          "validation.sc.pixel",
          "validation.sc.encapsulation"
        ],
        "projection_rule_ids": [
          "projection.curated"
        ],
        "determinism": "byte_stable",
        "stressors": [
          "minimal_secondary_capture",
          "encapsulated_pixel_data",
          "rle_lossless_transfer_syntax"
        ]
      }
    ]
  }
}
